{"objectives":"objective.relay.collect_scrap~collect_item~item.salvage.scrap_metal~Collect relay scrap for the workshop.~2~false;objective.relay.extract~extract~room.relay.extraction_lift~Reach the extraction lift safely.~1~false","scene_id":"scene.raid.relay_tunnels","id":"mission.salvage_run.relay_tunnels","side_objectives":"objective.relay.nanofiber~collect_item~item.material.nanofiber~Recover bonus Nanofiber from the relay catwalk.~1~true","display_name":"Relay Salvage Run","review_record_id":"review.mission.mission.salvage_run.relay_tunnels","fail_rule_id":"fail_rule.standard_extraction","tutorial_hook_ids":"hook.tutorial.traversal","room_variant_ids":"room_variant.relay_tunnels.long_corridor,room_variant.relay_tunnels.ambush_fork,room_variant.relay_tunnels.catwalk_run,room_variant.relay_tunnels.extraction_lift","encounter_pattern_ids":"encounter.relay_tunnels.escort_gauntlet","extraction_countdown_seconds":"6","zone_id":"zone.relay_tunnels","template_family_id":"salvage_run","recommended_minutes":"8","lesson_tip_id":"tip.raid.keep_rarity_feedback","feedback_tag_ids":"tag.feedback.reward,tag.feedback.extraction,tag.feedback.danger","zone_display_name":"Relay Tunnels","upgrade_track_id":"track.inventory_capacity","reward_items":"item.salvage.scrap_metal=2"}
