{"objectives":"objective.salvage.collect_scrap~collect_item~item.salvage.scrap_metal~Collect three Scrap Metal.~3~false;objective.salvage.extract~extract~room.raid.extraction_pad~Reach the extraction pad and leave safely.~1~false","scene_id":"scene.raid.machine_silo","id":"mission.salvage_run.machine_silo","side_objectives":"objective.salvage.power_cell~collect_item~item.salvage.power_cell~Recover a Power Cell from the high-risk vault.~1~true","display_name":"Salvage Run","review_record_id":"review.mission.mission.salvage_run.machine_silo","fail_rule_id":"fail_rule.standard_extraction","tutorial_hook_ids":"hook.tutorial.first_combat,hook.tutorial.loot","room_variant_ids":"room_variant.machine_silo.entry_platform,room_variant.machine_silo.patrol_hall,room_variant.machine_silo.salvage_nook,room_variant.machine_silo.guard_post,room_variant.machine_silo.extraction_pad","encounter_pattern_ids":"encounter.machine_silo.patrol_pair","extraction_countdown_seconds":"6","zone_id":"zone.machine_silo","template_family_id":"salvage_run","recommended_minutes":"9","lesson_tip_id":"tip.raid.keep_rarity_feedback","feedback_tag_ids":"tag.feedback.danger,tag.feedback.reward,tag.feedback.extraction","zone_display_name":"Machine Silo","upgrade_track_id":"track.inventory_capacity","reward_items":"item.salvage.scrap_metal=2"}
