{"objectives":"objective.artifact.recover~collect_item~item.quest.artifact_seed~Recover the Artifact Seed.~1~false;objective.artifact.extract~extract~room.sky.launch_pad~Extract with the Artifact Seed.~1~false","scene_id":"scene.raid.sky_docks","id":"mission.recover_artifact.sky_docks","side_objectives":"objective.artifact.side_salvage~collect_item~item.material.nanofiber~Grab bonus Nanofiber on the way out.~1~true","display_name":"Recover Artifact","review_record_id":"review.mission.mission.recover_artifact.sky_docks","fail_rule_id":"fail_rule.artifact_preserved","tutorial_hook_ids":"hook.tutorial.artifact","room_variant_ids":"room_variant.sky_docks.cargo_crossroads,room_variant.sky_docks.artifact_vault,room_variant.sky_docks.maintenance_bypass,room_variant.sky_docks.launch_pad","encounter_pattern_ids":"encounter.sky_docks.artifact_watch","extraction_countdown_seconds":"6","zone_id":"zone.sky_docks","template_family_id":"recover_artifact","recommended_minutes":"10","lesson_tip_id":"tip.raid.quest_items_are_safe","feedback_tag_ids":"tag.feedback.reward,tag.feedback.extraction,tag.feedback.danger","zone_display_name":"Sky Docks","upgrade_track_id":"track.player_tools","reward_items":"item.material.nanofiber=1"}
