{"objectives":"objective.escort.keep_companion_safe~escort~companion~Escort the companion through the relay tunnels.~1~false;objective.escort.extract~extract~room.relay.extraction_lift~Extract together.~1~false","scene_id":"scene.raid.relay_tunnels","id":"mission.escort_companion.relay_tunnels","side_objectives":"objective.escort.scan_loot~scan_loot~room.relay.catwalk_run~Let the companion ping optional loot.~1~true","display_name":"Escort Companion","review_record_id":"review.mission.mission.escort_companion.relay_tunnels","fail_rule_id":"fail_rule.companion_downed","tutorial_hook_ids":"hook.tutorial.revive,hook.tutorial.extract","room_variant_ids":"room_variant.relay_tunnels.long_corridor,room_variant.relay_tunnels.ambush_fork,room_variant.relay_tunnels.catwalk_run,room_variant.relay_tunnels.extraction_lift","encounter_pattern_ids":"encounter.relay_tunnels.escort_gauntlet,encounter.relay_tunnels.extraction_rush","extraction_countdown_seconds":"6","zone_id":"zone.relay_tunnels","template_family_id":"escort_companion","recommended_minutes":"11","lesson_tip_id":"tip.raid.watch_companion_highlights","feedback_tag_ids":"tag.feedback.companion_decision,tag.feedback.extraction,tag.feedback.danger","zone_display_name":"Relay Tunnels","upgrade_track_id":"track.companion_capabilities","reward_items":"item.salvage.scrap_metal=1,item.material.nanofiber=1"}
