{"objectives":"objective.machine.activate~activate_target~room.sky.launch_pad~Activate the launch stabilizer on the pad.~1~false;objective.machine.extract~extract~room.sky.launch_pad~Extract after the machine comes online.~1~false","scene_id":"scene.raid.sky_docks","id":"mission.activate_machine.sky_docks","side_objectives":"objective.machine.repair~repair_target~item.tool.field_wrench~Use the Field Wrench to repair a damaged relay panel.~1~true","display_name":"Activate Machine","review_record_id":"review.mission.mission.activate_machine.sky_docks","fail_rule_id":"fail_rule.machine_timeout","tutorial_hook_ids":"hook.tutorial.timed_run","room_variant_ids":"room_variant.sky_docks.cargo_crossroads,room_variant.sky_docks.wind_corridor,room_variant.sky_docks.launch_pad","encounter_pattern_ids":"encounter.sky_docks.launch_lane","extraction_countdown_seconds":"6","zone_id":"zone.sky_docks","template_family_id":"activate_machine","recommended_minutes":"8","lesson_tip_id":"tip.raid.tools_support_objectives","feedback_tag_ids":"tag.feedback.maker_success,tag.feedback.extraction,tag.feedback.danger","zone_display_name":"Sky Docks","upgrade_track_id":"track.player_tools","reward_items":"item.material.nanofiber=1"}
