{"objectives":"objective.timed.loot~collect_item~item.salvage.power_cell~Grab the Power Cell before the timer expires.~1~false;objective.timed.extract~extract~room.raid.extraction_pad~Reach extraction before the countdown ends.~1~false","scene_id":"scene.raid.machine_silo","id":"mission.timed_extraction.machine_silo","side_objectives":"objective.timed.side_console~activate_target~room.raid.generator_room~Activate the side console for bonus salvage.~1~true","display_name":"Timed Extraction","review_record_id":"review.mission.mission.timed_extraction.machine_silo","fail_rule_id":"fail_rule.timer_expired","tutorial_hook_ids":"hook.tutorial.high_risk","room_variant_ids":"room_variant.machine_silo.entry_platform,room_variant.machine_silo.guard_post,room_variant.machine_silo.high_risk_vault,room_variant.machine_silo.extraction_pad","encounter_pattern_ids":"encounter.machine_silo.guard_post,encounter.machine_silo.vault_watch","extraction_countdown_seconds":"5","zone_id":"zone.machine_silo","template_family_id":"timed_extraction","recommended_minutes":"7","lesson_tip_id":"tip.raid_reduced_time_pressure_available","feedback_tag_ids":"tag.feedback.danger,tag.feedback.reward,tag.feedback.extraction","zone_display_name":"Machine Silo","upgrade_track_id":"track.creator_unlocks","reward_items":"item.salvage.power_cell=1"}
